{
  "approvalPolicy": "never",
  "commandExecution": "trusted-fixture-only",
  "realAgentLaunch": "disabled",
  "runId": "demo-todo-app",
  "runnerMode": "scripted-simulator",
  "sandbox": "workspace-only",
  "schemaVersion": "1.0",
  "source": "makeitreal:plan",
  "unsupportedToolCall": "fail-fast",
  "userInputRequired": "fail-fast"
}
