{
  "schemaVersion": "1.0",
  "runnerMode": "claude-code",
  "realAgentLaunch": "disabled",
  "approvalPolicy": "never",
  "sandbox": "workspace-only",
  "commandExecution": "structured-command-only",
  "userInputRequired": "fail-fast",
  "unsupportedToolCall": "fail-fast",
  "source": "makeitreal:plan",
  "runId": "feature-auth"
}
